{
  "intro": "Four modules follow the Generative AI Leader exam guide's sections and weights. Each combines a study guide, exam tips, key terms, visual slides, and a narrated lesson. Google renamed Vertex AI to Gemini Enterprise Agent Platform in April 2026; lessons use the new names and mention the old ones.",
  "updated": "2026-10-28",
  "sources": [
    {
      "title": "Google Cloud: Generative AI Leader certification",
      "url": "https://cloud.google.com/learn/certification/generative-ai-leader"
    },
    {
      "title": "Generative AI Leader exam guide (PDF)",
      "url": "https://services.google.com/fh/files/misc/generative_ai_leader_exam_guide_english.pdf"
    },
    {
      "title": "Generative AI Leader study guide (PDF)",
      "url": "https://services.google.com/fh/files/misc/generative_ai_leader_study_guide_english.pdf"
    },
    {
      "title": "Google Generative AI Leader Certification Course (freeCodeCamp, YouTube)",
      "url": "https://www.youtube.com/watch?v=30diF8dKpAY",
      "note": "Free · Generative AI Leader · ~3.5-hour course · October 2025, so it uses pre-April-2026 names like Vertex AI · checked October 2026"
    }
  ],
  "modules": [
    {
      "id": "D1",
      "short": "Gen AI fundamentals",
      "title": "Fundamentals of gen AI",
      "summary": "Define core AI and gen AI concepts, learning types, and the ML lifecycle; understand data types and quality; know the layers of the gen AI landscape; and match Google's foundation models (Gemini, Gemma, Imagen, Veo) to use cases.",
      "guide": [
        {
          "h": "What this domain covers",
          "html": "<p>Section 1 is about <b>30%</b> of the Generative AI Leader exam. It's aimed at leaders, so it tests understanding and business judgment rather than coding.</p>"
        },
        {
          "h": "Core concepts",
          "html": "<p><b>AI</b> is the broad field; <b>machine learning</b> learns from data; <b>natural language processing</b> works with human language; <b>generative AI</b> creates new content. <b>Foundation models</b> are large models trained on broad data and adapted to many tasks. <b>LLMs</b> are foundation models for language, <b>multimodal</b> models handle several data types, and <b>diffusion models</b> generate images and video. Learning types are supervised (labeled data), unsupervised (finding structure), and reinforcement (learning from rewards). The ML lifecycle runs data ingestion, preparation, training, deployment, and management, and Google Cloud has tools for each stage.</p>"
        },
        {
          "h": "Data matters",
          "html": "<p>Data quality depends on <b>completeness</b>, <b>consistency</b>, <b>relevance</b>, <b>availability</b>, <b>cost</b>, and <b>format</b>. <b>Structured</b> data fits tables (sales records). <b>Unstructured</b> data is text, images, audio, and video (emails, call recordings). <b>Labeled</b> data has known answers for training; <b>unlabeled</b> data doesn't. Poor data leads to poor or biased output.</p>"
        },
        {
          "h": "The gen AI landscape and Google's models",
          "html": "<p>Think in layers: <b>infrastructure</b> (compute like TPUs and GPUs), <b>models</b>, <b>platforms</b> (tools to build and manage), <b>agents</b> (systems that reason and use tools), and <b>applications</b> (what end users touch). Google's models: <b>Gemini</b> (multimodal, Google's most capable family), <b>Gemma</b> (lightweight open models you can run and customize yourself), <b>Imagen</b> (text-to-image), and <b>Veo</b> (video generation). Choose a model by modality, context window, security, availability and reliability, cost, performance, and customization options.</p>"
        }
      ],
      "tips": [
        "Pick the model by modality first, then cost and performance.",
        "Gemma = open and lightweight; Gemini = flagship multimodal.",
        "Imagen makes images; Veo makes video.",
        "Data quality: complete, consistent, relevant, available.",
        "Know the five landscape layers in order."
      ],
      "terms": [
        [
          "Foundation model",
          "Large model trained on broad data, adaptable to many tasks."
        ],
        [
          "Multimodal",
          "Able to process several data types, such as text, images, audio, and video."
        ],
        [
          "Diffusion model",
          "Generates images or video by gradually removing noise."
        ],
        [
          "Structured data",
          "Organized in rows and columns."
        ],
        [
          "Labeled data",
          "Examples with known correct answers."
        ],
        [
          "Gemini",
          "Google's flagship multimodal model family."
        ],
        [
          "Gemma",
          "Google's lightweight open models."
        ],
        [
          "Context window",
          "How much input a model can consider at once."
        ]
      ],
      "slides": [
        {
          "title": "Gen AI fundamentals",
          "bullets": [
            "About 30% of the exam",
            "Concepts, data, landscape, models",
            "Business judgment over code"
          ],
          "script": [
            "Welcome to the gen AI fundamentals module. This section of the Generative AI Leader exam tests whether you understand the concepts and can make sound business choices."
          ],
          "visual": {
            "type": "layers",
            "items": [
              {
                "t": "Applications",
                "d": "What users touch"
              },
              {
                "t": "Agents",
                "d": "Reason and use tools"
              },
              {
                "t": "Platforms",
                "d": "Build and manage"
              },
              {
                "t": "Models",
                "d": "Gemini · Gemma · Imagen · Veo"
              },
              {
                "t": "Infrastructure",
                "d": "TPUs · GPUs"
              }
            ]
          },
          "layout": "title"
        },
        {
          "title": "Core concepts",
          "bullets": [
            "AI ⊃ ML ⊃ gen AI",
            "Foundation models and LLMs",
            "Supervised · unsupervised · reinforcement"
          ],
          "script": [
            "Artificial intelligence is the broad field, machine learning learns from data, and generative AI creates new content. Foundation models are trained broadly and adapted to many tasks.",
            "Supervised learning uses labeled data, unsupervised learning finds patterns, and reinforcement learning learns from rewards."
          ],
          "visual": {
            "type": "flow",
            "steps": [
              {
                "t": "Ingest",
                "d": "Data"
              },
              {
                "t": "Prepare",
                "d": "Clean · label"
              },
              {
                "t": "Train",
                "d": "Model"
              },
              {
                "t": "Deploy",
                "d": "Serve"
              },
              {
                "t": "Manage",
                "d": "Monitor"
              }
            ]
          }
        },
        {
          "title": "Data quality and types",
          "bullets": [
            "Complete, consistent, relevant",
            "Structured vs. unstructured",
            "Labeled vs. unlabeled"
          ],
          "script": [
            "Good results start with good data: complete, consistent, relevant, available, affordable, and in a usable format.",
            "Structured data fits tables, unstructured data includes text, images, and audio, and labeled data has known answers."
          ],
          "visual": {
            "type": "table",
            "head": [
              "Type",
              "Example"
            ],
            "rows": [
              [
                "Structured",
                "Sales table"
              ],
              [
                "Unstructured",
                "Customer emails"
              ],
              [
                "Labeled",
                "Photos tagged cat/dog"
              ],
              [
                "Unlabeled",
                "Raw call recordings"
              ]
            ]
          }
        },
        {
          "title": "Google's foundation models",
          "bullets": [
            "Gemini: multimodal flagship",
            "Gemma: open and lightweight",
            "Imagen: images · Veo: video"
          ],
          "script": [
            "Gemini is Google's most capable multimodal family. Gemma is a lightweight open model family you can run and customize yourself.",
            "Imagen generates images from text, and Veo generates video. Choose by modality, context window, cost, performance, and customization."
          ],
          "visual": {
            "type": "cards",
            "items": [
              {
                "t": "Gemini",
                "d": "Multimodal reasoning"
              },
              {
                "t": "Gemma",
                "d": "Open · lightweight"
              },
              {
                "t": "Imagen",
                "d": "Text → image"
              },
              {
                "t": "Veo",
                "d": "Text → video"
              }
            ]
          }
        },
        {
          "title": "Review: gen AI fundamentals",
          "bullets": [
            "Explain the concepts",
            "Judge the data",
            "Pick the model"
          ],
          "script": [
            "You've finished the fundamentals overview. Practice choosing a Google model for a business use case and naming the data issue in a scenario.",
            "Then try the fundamentals question set."
          ]
        }
      ]
    },
    {
      "id": "D2",
      "short": "Google Cloud offerings",
      "title": "Google Cloud's gen AI offerings",